{"access":{"mechanism":"direct","preconditions":["Downloaded by the owner from the publisher's Hugging Face repository at the pinned revision.","The full dataset is a commercial product and is not used."]},"datasetId":"datacluster-indian-number-plates-sample","datasetName":"Indian Number Plates Dataset (DataCluster Labs sample)","exposure":{"basis":"A public sample on Hugging Face and Kaggle; public plate recognisers may have seen it. Each instrument's exposure is recorded in its specification.","status":"possible"},"frameTime":{"kind":"still-images"},"intendedUse":"development-benchmarking","manifest":{"entries":[],"kind":"file-hashes"},"nativeTaxonomy":[{"code":"number_plate","definition":"DataCluster object 'number_plate' with optional number_plate_text.","name":"Number plate"}],"release":"Hugging Face Dataclusterlabspvtltd/indian-number-plates-dataset (sample) at 2bb7cd4e46e58af4f6fa413ce8e205ac69e605a7","researchUse":{"basis":"CC BY-NC-ND 4.0; the card offers the sample 'for evaluation purposes'. Non-commercial research evaluation with attribution; derived crops stay local and are never shared (NoDerivatives restricts sharing adapted material), so nothing is redistributed.","redistribution":"not-permitted-by-default","status":"RESEARCH-ADMISSIBLE","termsReference":"https://huggingface.co/datasets/Dataclusterlabspvtltd/indian-number-plates-dataset"},"schemaVersion":"benchmark-dataset-release-v1","source":{"kind":"official","retrievedOn":"2026-10-12","url":"https://huggingface.co/datasets/Dataclusterlabspvtltd/indian-number-plates-dataset"},"splits":[{"labelled":true,"name":"sample","role":"evaluation"}],"task":"plate-recognition"}