{"access":{"mechanism":"direct","preconditions":["Downloaded from the authors' Zenodo record (open access); the archive MD5 equals the record's."]},"datasetId":"uc3m-lp","datasetName":"UC3M-LP Spanish licence plates","exposure":{"basis":"An open benchmark since 2024; public plate recognisers may have trained on it. The phase-1 detector trains on COCO 2017 only.","status":"possible"},"frameTime":{"kind":"still-images"},"intendedUse":"development-benchmarking","manifest":{"entries":[],"kind":"file-hashes"},"nativeTaxonomy":[{"code":"A","definition":"Long one-row white plate (most vehicles).","name":"Type A"},{"code":"B","definition":"Motorcycle two-row white plate.","name":"Type B"},{"code":"C","definition":"Light-motorcycle one-row yellow plate.","name":"Type C"},{"code":"D","definition":"Taxi/VTC blue plate.","name":"Type D"},{"code":"E","definition":"Trailer-tow red plate.","name":"Type E"}],"release":"UC3M-LP (Zenodo record 17152029, v1, 2024-02-01; UC3M-LP.zip md5 496e3b5e66b78d231f71d85c0e5e11a3)","researchUse":{"basis":"The authors publish the data openly: the Zenodo record states CC BY 4.0 and the documenting repository states ODbL-1.0. Both permit research evaluation with attribution; nothing is redistributed. The images were anonymised by the authors (blurred characters, altered colours).","redistribution":"not-permitted-by-default","status":"RESEARCH-ADMISSIBLE","termsReference":"https://zenodo.org/records/17152029; https://github.com/ramajoballester/uc3m-lp"},"schemaVersion":"benchmark-dataset-release-v1","source":{"kind":"official","retrievedOn":"2026-10-12","url":"https://zenodo.org/records/17152029"},"splits":[{"labelled":true,"name":"test","role":"evaluation"},{"labelled":true,"name":"train","role":"reserved-unread"}],"task":"plate-recognition"}