{"access":{"mechanism":"agreement","preconditions":["The operator agrees to the BDD100K license before downloading (download.rst: 'By downloading the data, you agree to the BDD100K license'); acceptance is never automated."]},"datasetId":"bdd100k-mot-2020","datasetName":"BDD100K box tracking","exposure":{"basis":"Not yet assessed: the detector's training data must be checked for BDD100K before a result is reported (harness plan section 13).","status":"unknown"},"frameTime":{"fpsDenominator":1,"fpsNumerator":5,"kind":"index-at-fps"},"intendedUse":"development-benchmarking","manifest":{"entries":[],"kind":"file-hashes"},"nativeTaxonomy":[{"code":"bicycle","definition":"BDD100K box-tracking category 'bicycle'. BDD100K publishes no written definition in its repository documentation (format.rst, read 2026-10-04); meaning is taken from the category name in a road-scene dataset.","name":"Bicycle"},{"code":"bus","definition":"BDD100K box-tracking category 'bus'. BDD100K publishes no written definition in its repository documentation (format.rst, read 2026-10-04); meaning is taken from the category name in a road-scene dataset.","name":"Bus"},{"code":"car","definition":"BDD100K box-tracking category 'car'; the official box_track config folds the raw names 'van' and 'caravan' into it. BDD100K publishes no written definition in its repository documentation (format.rst, read 2026-10-04); meaning is taken from the category name in a road-scene dataset.","name":"Car"},{"code":"motorcycle","definition":"BDD100K box-tracking category 'motorcycle'; the official config folds the raw name 'motor' into it. BDD100K publishes no written definition in its repository documentation (format.rst, read 2026-10-04); meaning is taken from the category name in a road-scene dataset.","name":"Motorcycle"},{"code":"other-person","definition":"BDD100K distractor category 'other person' (evaluate.rst: an ignored region in official scoring).","name":"Other person"},{"code":"other-vehicle","definition":"BDD100K distractor category 'other vehicle' (evaluate.rst: an ignored region in official scoring).","name":"Other vehicle"},{"code":"pedestrian","definition":"BDD100K box-tracking category 'pedestrian'; the official config folds the raw name 'person' into it. BDD100K publishes no written definition in its repository documentation (format.rst, read 2026-10-04); meaning is taken from the category name in a road-scene dataset.","name":"Pedestrian"},{"code":"rider","definition":"BDD100K box-tracking category 'rider'. BDD100K publishes no written definition in its repository documentation (format.rst, read 2026-10-04); meaning is taken from the category name in a road-scene dataset.","name":"Rider"},{"code":"trailer","definition":"BDD100K distractor category 'trailer' (evaluate.rst: an ignored region in official scoring).","name":"Trailer"},{"code":"train","definition":"BDD100K box-tracking category 'train'. BDD100K publishes no written definition in its repository documentation (format.rst, read 2026-10-04); meaning is taken from the category name in a road-scene dataset.","name":"Train"},{"code":"truck","definition":"BDD100K box-tracking category 'truck'. BDD100K publishes no written definition in its repository documentation (format.rst, read 2026-10-04); meaning is taken from the category name in a road-scene dataset.","name":"Truck"}],"release":"MOT 2020 (box_track_20)","researchUse":{"basis":"The BDD100K license permits use 'for educational, research, and not-for-profit purposes, without fee'; to be confirmed against the licence accepted at download.","redistribution":"not-permitted-by-default","status":"RESEARCH-ADMISSIBLE","termsReference":"https://github.com/bdd100k/bdd100k/tree/master/doc/source/license.rst"},"schemaVersion":"benchmark-dataset-release-v1","source":{"kind":"official","retrievedOn":"2026-10-04","url":"https://dl.cv.ethz.ch/bdd100k/data/"},"splits":[{"labelled":true,"name":"val","role":"evaluation"}],"task":"box-tracking"}