{"access":{"mechanism":"agreement","preconditions":["The owner requests the dataset through the authors' licence agreement (academic research, non-commercial); acquisition is never automated.","The release archive's SHA-256 is recorded on intake; the manifest is frozen from the extracted tree."]},"datasetId":"ufpr-alpr","datasetName":"UFPR-ALPR","exposure":{"basis":"The phase-1 detector trains on COCO 2017 only. Public plate recognisers (the measuring instruments) may have trained on UFPR-ALPR; each instrument's exposure is recorded in its specification.","status":"possible"},"frameTime":{"fpsDenominator":1,"fpsNumerator":30,"kind":"index-at-fps"},"intendedUse":"development-benchmarking","manifest":{"entries":[],"kind":"file-hashes"},"nativeTaxonomy":[{"code":"car","definition":"UFPR-ALPR vehicle type 'car' (one-row Brazilian plate).","name":"Car"},{"code":"motorcycle","definition":"UFPR-ALPR vehicle type 'motorcycle' (two-row Brazilian plate).","name":"Motorcycle"}],"release":"UFPR-ALPR (IJCNN 2018 release; training/validation/testing)","researchUse":{"basis":"The authors release UFPR-ALPR for academic research only, free to researchers at educational or research institutes for non-commercial purposes, under a licence agreement the owner signs. Development benchmarking is research evaluation; nothing is redistributed.","redistribution":"not-permitted-by-default","status":"RESEARCH-ADMISSIBLE","termsReference":"https://github.com/raysonlaroca/ufpr-alpr-dataset"},"schemaVersion":"benchmark-dataset-release-v1","source":{"kind":"official","retrievedOn":"2026-10-12","url":"https://github.com/raysonlaroca/ufpr-alpr-dataset"},"splits":[{"labelled":true,"name":"testing","role":"evaluation"},{"labelled":true,"name":"training","role":"reserved-unread"},{"labelled":true,"name":"validation","role":"reserved-unread"}],"task":"plate-recognition"}