{"access":{"mechanism":"registration","preconditions":["The images are the BDD100K MOT 2020 val archive obtained by the owner from the Berkeley BDD100K MOT mirror under the BDD100K license; acquisition is never automated.","The derived annotation is public; it is accepted only with the pinned SHA-256."]},"datasetId":"bdd100k-mot-2020-cocofmt","datasetName":"BDD100K box tracking (derived COCO-format annotation)","exposure":{"basis":"The qualified detector (RTMDet-m COCO, resolved config sha256 377d9f57…) trains on COCO 2017 only, loads no other checkpoint and declares no pretrained backbone; no MAVI record names BDD100K use.","status":"none-known"},"frameTime":{"fpsDenominator":1,"fpsNumerator":5,"kind":"index-at-fps"},"intendedUse":"development-benchmarking","manifest":{"entries":[],"kind":"file-hashes"},"nativeTaxonomy":[{"code":"bicycle","definition":"BDD100K 'bicycle' after the official box_track name mapping (raw 'bike' folded in).","name":"Bicycle"},{"code":"bus","definition":"BDD100K 'bus' after the official box_track name mapping.","name":"Bus"},{"code":"car","definition":"BDD100K 'car' after the official box_track name mapping (which maps 'van' and 'caravan' to 'car' if such aliases are present; 'other vehicle' only as an ignored distractor).","name":"Car"},{"code":"motorcycle","definition":"BDD100K 'motorcycle' after the official box_track name mapping (raw 'motor' folded in).","name":"Motorcycle"},{"code":"pedestrian","definition":"BDD100K 'pedestrian' after the official box_track name mapping (raw 'person' folded in; 'other person' only as an ignored distractor).","name":"Pedestrian"},{"code":"rider","definition":"BDD100K 'rider' after the official box_track name mapping.","name":"Rider"},{"code":"train","definition":"BDD100K 'train' after the official box_track name mapping.","name":"Train"},{"code":"truck","definition":"BDD100K 'truck' after the official box_track name mapping ('trailer' only as an ignored distractor).","name":"Truck"}],"release":"MOT 2020 val (box_track_20) via MASA COCO-format derivative sha256:074ff795","researchUse":{"basis":"The annotation is a converted representation of BDD100K labels hosted by the MASA authors. Development use of the underlying labels is governed by the BDD100K data and label license, which permits use 'for educational, research, and not-for-profit purposes, without fee'. MASA is the retrieval and conversion source; its repository licence is not treated as relicensing the BDD100K annotation data.","redistribution":"not-permitted-by-default","status":"RESEARCH-ADMISSIBLE","termsReference":"https://github.com/bdd100k/bdd100k/tree/master/doc/source/license.rst"},"schemaVersion":"benchmark-dataset-release-v1","source":{"credibilityBasis":"Annotation: the MASA authors' Hugging Face repository at commit 25ed372c47f2c46cf36fd446d1b657b656bc7ea9, pinned by SHA-256 074ff79555483296cf7ccadddeeceeec7a83452c900506dc46588ed3a3e65d5d (the Hub's LFS object id); produced by the official bdd100k.label.to_coco box_track conversion. Its lineage against raw official labels is a required check (lineage()) whose result is recorded with the H3 run, not asserted here. Images: the BDD100K MOT 2020 val image archive the owner obtained from the Berkeley BDD100K MOT mirror (archive SHA-256 recorded with the run).","kind":"research-mirror","retrievedOn":"2026-10-05","url":"https://huggingface.co/dereksiyuanli/masa/resolve/25ed372c47f2c46cf36fd446d1b657b656bc7ea9/bdd_box_track_val_cocofmt.json"},"splits":[{"labelled":true,"name":"val","role":"evaluation"}],"task":"box-tracking"}