{
  "schemaVersion": "benchmark-dataset-release-v1",
  "datasetId": "synthetic-vehicles",
  "datasetName": "Synthetic vehicles",
  "release": "synthetic-v1",
  "task": "box-tracking",
  "source": {
    "kind": "official",
    "url": "https://mavi.local/synthetic-vehicles",
    "retrievedOn": "2026-10-04"
  },
  "access": {
    "mechanism": "direct",
    "preconditions": []
  },
  "intendedUse": "development-benchmarking",
  "researchUse": {
    "status": "RESEARCH-ADMISSIBLE",
    "basis": "Synthetic data generated by the test suite.",
    "termsReference": "tools/benchmarks/datasets/synthetic.py",
    "redistribution": "not-permitted-by-default"
  },
  "splits": [
    {
      "name": "train",
      "labelled": true,
      "role": "training"
    },
    {
      "name": "val",
      "labelled": true,
      "role": "evaluation"
    }
  ],
  "nativeTaxonomy": [
    {
      "code": "bus",
      "name": "Bus",
      "definition": "Synthetic: a large passenger vehicle."
    },
    {
      "code": "car",
      "name": "Car",
      "definition": "Synthetic: a passenger car."
    },
    {
      "code": "motorcycle",
      "name": "Motorcycle",
      "definition": "Synthetic: a two-wheeled motor vehicle."
    },
    {
      "code": "pedestrian",
      "name": "Pedestrian",
      "definition": "Synthetic: a person on foot (not a Vehicle)."
    },
    {
      "code": "truck",
      "name": "Truck",
      "definition": "Synthetic: a goods vehicle."
    },
    {
      "code": "van",
      "name": "Van",
      "definition": "Synthetic: a van whose body type is not resolved."
    }
  ],
  "frameTime": {
    "kind": "index-at-fps",
    "fpsNumerator": 5,
    "fpsDenominator": 1
  },
  "manifest": {
    "kind": "file-hashes",
    "entries": [
      {
        "path": "annotations/train/seq-c.json",
        "sizeBytes": 392,
        "sha256": "a2158afd09a588ae8cc77aece310239eb08df0dd68bdfe85a877989c63133a0a"
      },
      {
        "path": "annotations/val/seq-a.json",
        "sizeBytes": 1457,
        "sha256": "60852b10a684d91a328bc28e07a62f5a978965189d8772fff86aac515e72918a"
      },
      {
        "path": "annotations/val/seq-b.json",
        "sizeBytes": 1159,
        "sha256": "a9ca897877b27c13446fa210cd7cf82c0b40886f61c062335748a52d6c96956d"
      },
      {
        "path": "frames/train/seq-c/000000.ppm",
        "sizeBytes": 1741,
        "sha256": "8349cbbf65daea3afa955fc486868612bb11fd7e1322b257e33937d4cff1a325"
      },
      {
        "path": "frames/train/seq-c/000001.ppm",
        "sizeBytes": 1741,
        "sha256": "31f4a254d35d657db5d70091032423e1802aa38a6da8a132dafea41bff1f1bd0"
      },
      {
        "path": "frames/train/seq-c/000002.ppm",
        "sizeBytes": 1741,
        "sha256": "a4c1ebb4153c8dcd98798d473a584656610b84b6c1178b8fff69ceef04140395"
      },
      {
        "path": "frames/train/seq-c/000003.ppm",
        "sizeBytes": 1741,
        "sha256": "ec8c47ae7a61ad573288c1c217321268c747a5105627deb53748b651e4225177"
      },
      {
        "path": "frames/val/seq-a/000000.ppm",
        "sizeBytes": 1741,
        "sha256": "eb47990b51393b6017e33b796ae9fd6b61d1592b8f8462b5ebed022fa0a6d5d8"
      },
      {
        "path": "frames/val/seq-a/000001.ppm",
        "sizeBytes": 1741,
        "sha256": "6633af4252e4502a63f5d7d345fa17c5853941a1a372f7ae7cba8269be5835bc"
      },
      {
        "path": "frames/val/seq-a/000002.ppm",
        "sizeBytes": 1741,
        "sha256": "4f3b0f66cb7bdc6147c1ed79e8f6fa94c3c99b8be0a0f36dbcaf0c577eaa2d38"
      },
      {
        "path": "frames/val/seq-a/000003.ppm",
        "sizeBytes": 1741,
        "sha256": "4bd94096cd5038ef54ad48ce35825fa316b9d6ac49d391156f2d2df39d663da4"
      },
      {
        "path": "frames/val/seq-a/000004.ppm",
        "sizeBytes": 1741,
        "sha256": "e8c7b6262bfbfaa2f77b61f244be49c449a21de7e8b666a438d9dd1ec66e5427"
      },
      {
        "path": "frames/val/seq-a/000005.ppm",
        "sizeBytes": 1741,
        "sha256": "d65979f9918f44439eaab2bbf96670ca8783377f359257cdc9abfee84c67225a"
      },
      {
        "path": "frames/val/seq-a/000006.ppm",
        "sizeBytes": 1741,
        "sha256": "f08fdd9f4893f330fe18ad9929e96685229e49be205fdcc245ad64669213c3f5"
      },
      {
        "path": "frames/val/seq-a/000007.ppm",
        "sizeBytes": 1741,
        "sha256": "005b7f5abbabdedc37d14173464f876976c3db834e00a5adf3f993f94429093f"
      },
      {
        "path": "frames/val/seq-b/000000.ppm",
        "sizeBytes": 1741,
        "sha256": "86ff0cda14a67ad1a34aa6af53a9885ee6db5dd84c372f0bd0d901cd1e348134"
      },
      {
        "path": "frames/val/seq-b/000001.ppm",
        "sizeBytes": 1741,
        "sha256": "e25b5abf083cb8aa54171fffd54e8a1155b459953840f82fb19e57e250d60de6"
      },
      {
        "path": "frames/val/seq-b/000002.ppm",
        "sizeBytes": 1741,
        "sha256": "c5a9ca3b7ec1f212dfb2915ca980dabe4b0f7cfacaa016122ec999474f6611ac"
      },
      {
        "path": "frames/val/seq-b/000003.ppm",
        "sizeBytes": 1741,
        "sha256": "0a0726dec2b2c52d7bcbb26aad88ac839a4f75a55a5a826de68b9e4f1fa6e9c5"
      },
      {
        "path": "frames/val/seq-b/000004.ppm",
        "sizeBytes": 1741,
        "sha256": "7dedbcef6e44933dcff287df424ff14e9d89f4067b6ca3266108e31a5bae2ea8"
      },
      {
        "path": "frames/val/seq-b/000005.ppm",
        "sizeBytes": 1741,
        "sha256": "f523d26c05ccec80d2a47e8c065a8d6c650f04bcfaab3e901f25d7705dcad9fd"
      }
    ]
  },
  "exposure": {
    "status": "none-known",
    "basis": "Synthetic data; no MAVI component has seen it."
  }
}
