{"access":{"mechanism":"direct","preconditions":[]},"datasetId":"visdrone2019-mot","datasetName":"VisDrone2019 multi-object tracking","exposure":{"basis":"The detector checkpoint is trained on COCO 2017 only (resolved config 377d9f57); no MAVI record names VisDrone; VisDrone images are not COCO images.","status":"none-known"},"frameTime":{"fpsDenominator":1,"fpsNumerator":30,"kind":"index-at-fps"},"intendedUse":"development-benchmarking","manifest":{"entries":[],"kind":"file-hashes"},"nativeTaxonomy":[{"code":"pedestrian","definition":"VisDrone category 'pedestrian' (1): a person standing or walking.","name":"Pedestrian"},{"code":"people","definition":"VisDrone category 'people' (2): a person in another pose (sitting, lying, riding).","name":"People"},{"code":"bicycle","definition":"VisDrone category 'bicycle' (3).","name":"Bicycle"},{"code":"car","definition":"VisDrone category 'car' (4). No written definition in the toolkit README; meaning from the name in an aerial road-scene dataset.","name":"Car"},{"code":"van","definition":"VisDrone category 'van' (5), annotated separately from car and truck.","name":"Van"},{"code":"truck","definition":"VisDrone category 'truck' (6). No written definition in the toolkit README.","name":"Truck"},{"code":"tricycle","definition":"VisDrone category 'tricycle' (7): a three-wheeled vehicle.","name":"Tricycle"},{"code":"awning-tricycle","definition":"VisDrone category 'awning-tricycle' (8): a three-wheeled vehicle with an awning.","name":"Awning tricycle"},{"code":"bus","definition":"VisDrone category 'bus' (9). No written definition in the toolkit README.","name":"Bus"},{"code":"motor","definition":"VisDrone category 'motor' (10): a motorised two-wheeler (the rider is annotated as people).","name":"Motor"},{"code":"others","definition":"VisDrone category 'others' (11): an object of no listed category; not evaluated by the VisDrone toolkits and ignored on every frame by this adapter.","name":"Others"}],"release":"VisDrone2019-MOT (val, test-dev; toolkit v1.0.2 category scheme)","researchUse":{"basis":"Openly obtainable without registration; the dataset repository states no licence, and the MOT toolkit says it is 'for research purpose only' and asks for citation. Used for Development benchmarking only; not redistributed.","redistribution":"not-permitted-by-default","status":"RESEARCH-UNCERTAIN","termsReference":"https://github.com/VisDrone/VisDrone-Dataset; https://github.com/VisDrone/VisDrone2018-MOT-toolkit"},"schemaVersion":"benchmark-dataset-release-v1","source":{"credibilityBasis":"The dataset authors' repository (AISKYEYE team, Tianjin University) links the release archives on the authors' Google Drive; archive bytes are pinned by SHA-256 in the H4 methodology freeze.","kind":"author-repository","retrievedOn":"2026-10-06","url":"https://github.com/VisDrone/VisDrone-Dataset"},"splits":[{"labelled":true,"name":"test-dev","role":"evaluation"},{"labelled":true,"name":"val","role":"evaluation"}],"task":"box-tracking"}